CompanyName, Designation, Ratings, Address
Honeywell, Software Engineer, 3.8, Redmond - WA 98052 (Overlake area)
Zulily, Software Engineer I, 3.2, Seattle - WA 98121 (Belltown area)
Nordstrom, Software Engineer - Product Platform Team, 3.9, Seattle - WA
The Climate Corporation, Software Engineer - Backend (Multiple levels), 3.6, Seattle - WA 98104 (Downtown area)
Microsoft, Software Engineer, 4.2, Redmond - WA
Facebook, Software Engineer - Blockchain (University Grad), 4.2, Seattle - WA 98101
Expedia.com, New Graduate - Software Development Engineer 1, 3.9, Seattle - WA 98119
Apple, Software Engineer - Front-end, 4.2, Seattle - WA
Convoy, Software Engineer _ Marketplace, 3.9, Seattle - WA 98121 (Denny Triangle area)
Microsoft, Software (Firmware) Development Engineer 2, 4.2, Redmond - WA
Zillow, Software Development Engineer - Zillow Offers Platform, 3.8, Seattle - WA 98101 (Downtown area)
Apple, Software Engineer - Front-end, 4.2, Seattle - WA
Agilysys - Inc., Junior Software Engineer, NaN, Bellevue - WA 98007 (Eastgate area)
Discovery Communications, Software Engineer I - iOS, 4.2, Bellevue - WA
lululemon athletica, Software Engineer, 4.3, Seattle - WA
GENSCRIPT USA INCORPORATED, Software Engineer, 3.7, Bothell - WA
Redfin, Software Development Engineer II (Customer Relationship Engi..., 3.3, Seattle - WA
Microsoft, Software (Firmware) Development Engineer 2, 4.2, Redmond - WA
HCL Americas, SOFTWARE ENGINEER, 2.7, King County - WA
f5, Software Engineer Intern, 4.0, Seattle - WA
Amazon.com Services LLC, Software Development Engineer I, 3.6, Seattle - WA
Axon, Software Engineer - Fleet, 3.2, Seattle - WA 98103 (Fremont area)
Zillow, Android Software Development Engineer, 3.8, Seattle - WA 98101 (Downtown area)
Microsoft, Full Time Opportunities for Students or Recent Graduates: So..., 4.2, Redmond - WA
Apple, AI/ML Software Engineer, 4.2, Seattle - WA
Comtech Telecommunications Corp., E911 Software Test Engineer, 3.5, Seattle - WA 98121 (Belltown area)
Motorola Solutions, Software Engineer (2020 Summer Internship), 4.1, Seattle - WA 98121 (Belltown area)
Dell, UDS Storage Software Engineer, 4.0, Seattle - WA 98133 (Broadview area)
Apple, Software Engineer, 4.2, Seattle - WA
Zillow Group, Software Development Engineer - Intern, 3.8, Seattle - WA 98101 (Downtown area)
Oracle, Software Engineer, 3.8, Seattle - WA
Motorola Solutions, Software Engineer (2020 Summer Internship), 4.1, Seattle - WA 98121 (Belltown area)
Discovery Communications, Software Engineer I - AndroidTV/FireTV, 4.2, Bellevue - WA
Discovery Communications, Software Engineer II - Roku, 4.2, Bellevue - WA
Zillow Group, Software Development Engineer - Intern, 3.8, Seattle - WA 98101 (Downtown area)
Discovery Communications, Software Development Engineer I, 4.2, Bellevue - WA
Microsoft, Software Engineer - CTJ, 4.2, Redmond - WA
Groupon - Inc., Frontend/Full Stack Software Engineer - Things to Do, 3.6, Seattle - WA 98101 (Downtown area)
Microsoft, Software Engineer II (Key Vault), 4.2, Redmond - WA
Vulcan Inc., Research Software Engineer Intern, 3.6, Seattle - WA
Google, Software Engineer - Stadia, 4.3, Seattle - WA
Zillow, Software Development Engineer- Listing Data, 3.8, Seattle - WA 98101 (Downtown area)
Microsoft, Software Engineer II (Key Vault), 4.2, Redmond - WA
Zulily, Software Engineer - Site, 3.2, Seattle - WA 98121 (Belltown area)
Microsoft, Software Engineer - CTJ, 4.2, Redmond - WA
Placements.io, Frontend Software Engineer, NaN, Seattle - WA 98104
Facebook, Software Engineer - Shell (Oculus), 4.2, Seattle - WA 98101
DocuSign, Front End Software Engineer – Data Clarity, 3.7, Seattle - WA 98101 (Downtown area)
Samsung Electronics, Software Development Engineer Intern - Summer 2020, 4.0, Bellevue - WA 98004 (Downtown area)
Samsung Electronics, Staff Engineer I - Software Process Engineering, 4.0, Bellevue - WA 98004 (Downtown area)
Facebook, Software Engineer - Shell (Oculus), 4.2, Seattle - WA 98101 (Downtown area)
Zulily, Software Engineer - Site, 3.2, Seattle - WA 98121 (Belltown area)
Accenture, Entry Level Accenture Technology Software Engineer Associate, 4.0, Seattle - WA 98104
Expedia.com, Software Development Engineer, 3.9, Seattle - WA 98119 (Queen Anne area)
Redfin, Software Development Engineer II (Transaction Efficiency), 3.3, Seattle - WA
Apple, Siri - Software Engineer, 4.2, Seattle - WA
Facebook, Software Engineer - Metric Specialist, 4.2, Seattle - WA 98101 (Downtown area)
Facebook, Software Engineer - Compiler Specialist, 4.2, Seattle - WA 98101 (Downtown area)
General Electric, Software Engineer, 4.0, Seattle - WA 98101 (Downtown area)
Voglio Marketing, Software Development Engineer - Entry Level, NaN, Seattle - WA
Apple, Siri - Software Engineer, 4.2, Seattle - WA
3MD Inc., Software Developer Engineer In Test, NaN, Redmond - WA 98052
Accenture, Entry Level Accenture Technology Software Engineer, 4.0, Seattle - WA 98101 (Downtown area)
Google, Software Engineer - Stadia, 4.3, Seattle - WA
ExtraHop Networks - Inc., Software Engineer | Middleware, 3.5, Seattle - WA 98101 (Downtown area)
Qualtrics, Software Engineer - Customer Experience, 4.3, Seattle - WA
JP Morgan Chase, Full Stack Software Engineer, 3.9, Seattle - WA 98101 (Downtown area)
Apple, Siri End2End Team - Software Engineer, 4.2, Seattle - WA
CDK Global, Software Engineer V, 3.1, Seattle - WA 98104
VMware, Member of Technical Staff – Software Engineer Bellevue - WA, 4.1, Bellevue - WA 98004 (Downtown area)
CDK Global, Software Engineer V, 3.1, Seattle - WA 98104
Oracle, Front End or Full Stack Software Engineer, 3.8, Bellevue - WA 98004 (Downtown area)
Alaska Airlines, Software Engineer - E-commerce, 3.9, Seattle - WA 98194 (Downtown area)
Facebook, Software Engineer - Metric Specialist, 4.2, Seattle - WA 98101 (Downtown area)
Qualtrics, Software Engineer - Experience Management Programs, 4.3, Seattle - WA
REI, Software Engineer Intern, 4.1, Bellevue - WA 98004 (Downtown area)
Microsoft, Full Time Opportunities for Students or Recent Graduates: Cy..., 4.2, Redmond - WA
Hewlett Packard Enterprise, Software Engineer Intern, 3.7, Seattle - WA
Daimler, Associate Software Engineer, 4.1, Seattle - WA 98101 (Downtown area)
PACCAR, Diagnostic Software Engineer, 3.6, Kirkland - WA 98033 (Highlands area)
f5, Innovation Software Engineer - Internship, 4.0, Seattle - WA
Microsoft, Software Engineer II - Full Stack, 4.2, Redmond - WA
Envestnet Asset Management - Inc, Software Developer Intern, NaN, Seattle - WA
Starbucks, engineer II - Seattle - WA, 4.0, Seattle - WA 98134 (Industrial District area)
Apple, Development Engineer, 4.2, Seattle - WA
University of Washington, SOFTWARE ENGINEER, 4.1, Seattle - WA
Apple, Siri - Software Engineer, 4.2, Seattle - WA
EagleView, Research Software Engineer Intern, 2.9, Bellevue - WA 98004 (Downtown area)
Oracle, Software Developer, 3.8, Seattle - WA
VMware, Member of Technical Staff – Software Engineer Bellevue - WA, 4.1, Bellevue - WA 98004 (Downtown area)
Pokemon Company International, Software Test Engineer, 2.5, Bellevue - WA
Facebook, Software Engineer - Product (Full Stack), 4.2, Seattle - WA 98101 (Downtown area)
Facebook, Software Engineer - Infrastructure, 4.2, Seattle - WA 98101 (Downtown area)
ABC Legal Services Inc., Software Development Engineer, 2.9, Seattle - WA 98104
Fred Hutchinson Cancer Research Center, Software Development Engineer, 4.2, Seattle - WA
Urban Influence, Jr. FrontEnd Developer, NaN, Seattle - WA 98122 (Capitol Hill area)
BOEING, Early career Real Time Software Engineer, 4.0, Tukwila - WA 98108
Oracle, Software Engineer (JoinOCI-NLSDST), 3.8, Seattle - WA
Uber, Front End Software Engineer, 3.8, Seattle - WA 98101
GoDaddy, Software Development Engineer (Full Stack Javascript), 3.6, Kirkland - WA
Microsoft, Security Software Engineer, 4.2, Redmond - WA
Amazon.com Services LLC, Software Development Engineer - Search Customer Experience, 3.6, Seattle - WA
Splunk, Software Engineer Intern (Summer 2020), 4.1, Seattle - WA
Microsoft, Software Security Engineer, 4.2, Redmond - WA
Microsoft, Principle Software Development Engineer, 4.2, Redmond - WA
Ekata - Inc., Software Engineer - Data Services, 5.0, Seattle - WA
Amazon Data Services - Inc., Software Development Engineer, 3.6, Seattle - WA
Apple, Snr iCloud Software Engineer, 4.2, Seattle - WA
Nintendo of America Inc., Software Engineer, 4.1, Redmond - WA 98052
Microsoft, Software Engineer - Minecraft, 4.2, Redmond - WA
Facebook, Software Engineer - Product (Full Stack), 4.2, Seattle - WA 98101 (Downtown area)
T-Mobile, Engineers - Software, 4.0, Bellevue - WA
Tesla, Video Games Engineer - Infotainment Software, 3.5, Bellevue - WA
Microsoft, Quantum Software Engineer, 4.2, Redmond - WA
Microsoft, Software Engineer – XBOX Live SDK, 4.2, Redmond - WA
Microsoft, Software Development Engineer - Quantum Libraries, 4.2, Redmond - WA
Google, Research Software Engineer - Augmented and Virtual Reality, 4.3, Seattle - WA
REI, Database/Middleware Engineer Intern, 4.1, Bellevue - WA 98004 (Wilburton area)
Urban Influence, Jr. FrontEnd Developer, NaN, Seattle - WA 98122 (Capitol Hill area)
Google, Software Engineer - Engineering Productivity, 4.3, Seattle - WA
Oracle, Full Stack Developer, 3.8, Seattle - WA
Google, Staff Software Engineer, 4.3, Seattle - WA
Splunk, Software Engineer Intern (Summer 2020), 4.1, Seattle - WA
Amazon.com Services LLC, Software Development Engineer - Test, 3.6, Seattle - WA
Axon, Software Engineer - Fleet, 3.2, Seattle - WA 98103 (Fremont area)
Starbucks, undergraduate or graduate intern - App Developer/Data Scienti..., 4.0, Seattle - WA
Uber, Staff Software Engineer, 3.8, Seattle - WA 98101
TableSafe Inc., Full Stack Software Developer, 3.5, Kirkland - WA
Microsoft, Internship Opportunities for Students: Software Engineering..., 4.2, Redmond - WA
Microsoft, Full Time Opportunities for Students or Recent Graduates: Fi..., 4.2, Redmond - WA
Google, Software Engineer - Database Systems, 4.3, Seattle - WA
Starbucks, software development engineer in test (SDET) - Production Con..., 4.0, Seattle - WA 98134 (Industrial District area)
Microsoft, Quantum Software Engineer, 4.2, Redmond - WA
Hulu, Software Developer - Android, 3.9, Seattle - WA
Outreach, Full-Stack Software Engineer - Orchestration Team, NaN, Seattle - WA 98103 (Green Lake - Wallingford area)
Nintendo of America Inc., Software Engineer, 4.1, Redmond - WA 98052
Luminator Technology Group, Software Engineer, 4.3, Bothell - WA 98021
Facebook, Software Engineer - Perceptual Science, 4.2, Redmond - WA
Qualtrics, Software Engineer - Customer Experience, 4.3, Seattle - WA
Apple, Development Engineer, 4.2, Seattle - WA
Facebook, Software Engineer - Compiler Specialist, 4.2, Seattle - WA 98101
Voglio Marketing, Software Development Engineer - Entry Level, NaN, Seattle - WA
Amazon.com Services LLC, Software Development Engineer - FireTV, 3.6, Seattle - WA
Zulily, Software Engineer - Site, 3.2, Seattle - WA 98121 (Belltown area)
Amazon.com Services LLC, Software Development Engineer - Material Catalog, 3.6, Seattle - WA
Microsoft, Principal Software Engineer, 4.2, Redmond - WA
Microsoft, Software Development Engineer - Quantum Libraries, 4.2, Redmond - WA
Avalara, Software Engineer - Returns (5788), 2.8, Seattle - WA 98104 (Pioneer Square area)
Amazon.com Services LLC, Software Development Engineer - Prime Now / AmazonFresh, 3.6, Seattle - WA
Electronic Arts, Software Engineer - C# and WPF - Frostbite - Audio and Movie, 3.9, Seattle - WA
Microsoft, Principal Software Engineer, 4.2, Redmond - WA
f5, Software Engineer 1, 4.0, Seattle - WA
JPMorgan Chase, Full Stack Software Engineer, 3.9, Seattle - WA 98101 (Downtown area)
Qualtrics, Software Engineer - Brand Experience, 4.3, Seattle - WA
Facebook, Software Engineer - Core Systems (Oculus), 4.2, Seattle - WA 98101 (Downtown area)
Amazon.com Services LLC, Jr. Front-End Software Engineer - AWS Elastic Load Balancing, 3.6, Seattle - WA
Expedia.com, Software Development Engineer II - Fullstack, 3.9, Seattle - WA 98119 (Queen Anne area)
EagleView, Research Software Engineer Intern, 2.9, Bellevue - WA 98004 (Downtown area)
Square, Software Engineer - API Platform, 3.7, Seattle - WA
Zillow, Senior Software Development Engineer - Zillow Offers, 3.8, Seattle - WA 98101 (Downtown area)
Qualtrics, Software Engineering Intern - Summer 2020 - Seattle - WA, 4.3, Seattle - WA
Microsoft, Quantum Software Engineer, 4.2, Redmond - WA
Apple, Siri - Software Engineer - Home Automation, 4.2, Seattle - WA
Facebook, Software Engineer - Core Systems (Oculus), 4.2, Seattle - WA 98101 (Downtown area)
REI, Software Engineer (Backend) Intern, 4.1, Bellevue - WA 98004 (Wilburton area)
Apple, Snr iCloud Software Engineer, 4.2, Seattle - WA
Expedia.com, Software Development Engineer II - Fullstack, 3.9, Seattle - WA 98119
Outreach, Full-Stack Software Engineer (Backend Focused) - Data Workflo..., NaN, Seattle - WA 98103 (Wallingford area)
JPMorgan Chase, Full Stack Software Engineer, 3.9, Seattle - WA 98101 (Downtown area)
Facebook, Software Engineer - Machine Perception Research, 4.2, Redmond - WA
Amazon.com Services LLC, Software Development Engineer - Search Customer Experience, 3.6, Seattle - WA
Microsoft, Principal Software Engineer, 4.2, Redmond - WA
SpaceCurve, C++ Software Engineer, 4.0, Seattle - WA
Ekata - Inc., Software Engineer - Data Services, 5.0, Seattle - WA
Microsoft, Internship Opportunities for Students: Software Engineering..., 4.2, Redmond - WA
Facebook, Software Engineer - AI Infra, 4.2, Seattle - WA 98101 (Downtown area)
Nintendo of America Inc., Intern - Graphics Software Engineer (NTD), 4.1, Redmond - WA
NVIDIA, Software Intern - Cloud Engineer for Autonomous Vehicles, 4.2, Redmond - WA 98052
Facebook, Software Engineer - Database Infrastructure Specialist, 4.2, Seattle - WA 98101 (Downtown area)
Microsoft, Server / Infrastructure Software Engineer, 4.2, Redmond - WA
Qualtrics, Software Engineer - Reporting Platform, 4.3, Seattle - WA
Microsoft, Software Engineer - Minecraft, 4.2, Redmond - WA
Starbucks, software development engineer in test (SDET) - Production Con..., 4.0, Seattle - WA 98134 (Industrial District area)
Daimler, Software Engineer, 4.1, Seattle - WA 98101 (Downtown area)
Apple, Software Engineer - Swift, 4.2, Seattle - WA
Microsoft, Software Engineer II - iOS/Android, 4.2, Redmond - WA
SoFi, Engineer - Software (Money), 3.1, Seattle - WA
Amazon.com Services LLC, Software Development Engineer - Ordering Platform, 3.6, Seattle - WA
Brooks Sports - Inc, QA Software Test Engineer, 4.0, Seattle - WA
Tyler Technologies - Inc., Software Test Engineer, 3.6, Seattle - WA
Facebook, Software Engineer - Messenger, 4.2, Seattle - WA 98101 (Downtown area)
TableSafe Inc., Full Stack Software Developer, 3.5, Kirkland - WA
Splunk, Software Engineer Intern (Summer 2020), 4.1, Seattle - WA
Amazon.com Services LLC, Software Development Engineer - Alexa Shopping, 3.6, Seattle - WA
Microsoft, Software Engineer – XBOX Live SDK, 4.2, Redmond - WA
Facebook, Front End Engineer, 4.2, Seattle - WA 98101 (Downtown area)
Facebook, Software Engineer - Mobile Performance, 4.2, Seattle - WA 98101 (Downtown area)
Facebook, Software Engineer - Graphics, 4.2, Redmond - WA
Axon, Software Engineer - Axon Records & Integrations, 3.2, Seattle - WA 98103 (Green Lake - Wallingford area)
Facebook, Software Engineer - Ads Ranking, 4.2, Seattle - WA 98101 (Downtown area)
Fluke, Software Engineer Intern, 3.6, Everett - WA 98203
Amazon.com Services LLC, Software Development Engineer - Alexa, 3.6, Seattle - WA
REI, Database/Middleware Engineer Intern, 4.1, Bellevue - WA 98004 (Downtown area)
American Red Cross, Quality Assurance Engineer - Innovation Team, 3.8, Seattle - WA 98113 (Green Lake area)
Microsoft, Software Developement Engineer II, 4.2, Redmond - WA
Facebook, FRL Tracking Software Engineer, 4.2, Redmond - WA
T-Mobile, 2020 TechX Professional Program - Software Engineering and D..., 4.0, Bellevue - WA
Pokemon Company International, Software Test Engineer, 2.5, Bellevue - WA
Amazon.com Services LLC, Software Development Engineer - Alexa Personality, 3.6, Seattle - WA
Convoy, Software Engineer, 3.9, Seattle - WA 98121 (Belltown area)
Novo Nordisk, Software Engineer II - Backend, 4.1, Seattle - WA 98109 (South Lake Union area)
NBBJ, Jr. Full Stack Developer, 2.2, Seattle - WA 98109 (South Lake Union area)
Oracle, Software Development Engineer- Security, 3.8, Seattle - WA
Convoy, Software Engineer - Machine Learning, 3.9, Seattle - WA
Discovery Communications, Software Engineering/ Data/ Product Internship General Summe..., 4.2, Bellevue - WA
Convoy, Software Engineer - Frontend, 3.9, Seattle - WA
Facebook, FRL Tracking Software Engineer, 4.2, Redmond - WA
Twitter, Software Engineer - Revenue Processing Platform, 4.1, Seattle - WA
Amazon.com Services LLC, Software Development Engineer Internship - Summer 2020 (US), 3.6, Seattle - WA
Outreach, Software Engineer - Data Platform, NaN, Seattle - WA
Facebook, FRL Tracking Software Engineer, 4.2, Redmond - WA
Costco Travel, Software Development Engineer in Test - Online Member Servic..., 4.2, Issaquah - WA 98027
Zulily, Senior Software Engineer – Customer Service Applications, 3.2, Seattle - WA 98121 (Belltown area)
Amazon.com Services LLC, Software Development Engineer - Workforce Experience, 3.6, Seattle - WA
Apple, Development Engineer, 4.2, Seattle - WA
GCI, Software Engineer - II, 4.0, Seattle - WA 98121 (Denny Triangle area)
Walt Disney Direct-to-Consumer and International, Customer Solutions Software Engineering Intern - Seattle - Su..., NaN, Seattle - WA
American Red Cross, Quality Assurance Engineer - Innovation Team, 3.8, Seattle - WA 98113 (Green Lake area)
Convoy, Software Engineer - Frontend, 3.9, Seattle - WA
Uber, Staff Software Engineer, 3.8, Seattle - WA 98101 (Downtown area)
Innovation IT Technologies, Computer Programmer, NaN, Bothell - WA
Facebook, FRL Software Engineer – Graphics/Optics, 4.2, Redmond - WA
Google, Software Engineer - Engineering Productivity, 4.3, Seattle - WA
f5, Innovation Software Engineer - Internship, 4.0, Seattle - WA
Outreach, Front-End Software Engineer - Orchestration Team, NaN, Seattle - WA
Qualtrics, Software Engineer - Product Experience, 4.3, Seattle - WA
Tata Technologies Inc., Software Engineer (DSP) - 3156, 3.8, Redmond - WA
Expedia.com, Salesforce Software Development Engineer I, 3.9, Bellevue - WA 98004 (Downtown area)
Microsoft, Software Reliability Engineer, 4.2, Bellevue - WA 98004 (Hidden Valley area)
Zulily, Software Engineer II - Engagement, 3.2, Seattle - WA 98121 (Belltown area)
Right Crowd, Technical Software Support Engineer, NaN, Seattle - WA 98121 (Belltown area)
NetMotion Software, Mobile Software Developer, NaN, Seattle - WA
MB Diversity, Software Development Engineer, NaN, Seattle - WA
Expedia.com, Software Dev Engineer II, 3.9, Bellevue - WA 98004
Innovation IT Technologies, Computer Programmer, NaN, Bothell - WA
Qualtrics, Software Engineer - Data Platform, 4.3, Seattle - WA
Amazon.com Services LLC, Software Development Engineer - Test, 3.6, Seattle - WA
Oracle, Sr. Software Engineer, 3.8, Seattle - WA
Amazon.com Services LLC, Software Development Engineer Internship - Summer 2020 (US), 3.6, Seattle - WA
3MD Inc., Software Engineer, NaN, Redmond - WA 98052
Friendly Consultants, Software Engineer, NaN, Bothell - WA
Pokemon Company International, Software Engineer (Pokemon.com), 2.5, Bellevue - WA
Microsoft, Software Security Engineer, 4.2, Redmond - WA
First Mode, Software Engineer, NaN, Seattle - WA
Tango Card, Full Stack Software Engineer, 5.0, Seattle - WA 98116 (Admiral area)
4C Insights, Software Development Engineer (Fullstack), NaN, Seattle - WA
EMD, Software Development Engineer, 4.0, Seattle - WA
Tune, Software Support Engineer, 3.7, Seattle - WA
Tesla, Software Engineer - Front End, 3.5, Bellevue - WA
Elektrobit Automotive, Software Engineer (AUTOSAR), 4.3, Bothell - WA
Elektrobit Automotive, Software Engineer (AUTOSAR), 4.3, Bothell - WA
Amazon.com Services LLC, Software Development Engineer - Datapath, 3.6, Seattle - WA
Amazon.com Services LLC, Software Development Engineer - Datapath Efficiency, 3.6, Seattle - WA
Amazon.com Services - Inc., Jr Software Engineer--Loss prevention investigation, 3.6, Seattle - WA
Oracle, Software Engineer - Serverless, 3.8, Seattle - WA
Outreach, Software Engineer - Data Platform, NaN, Seattle - WA
Tesla, Software Engineer - Front End, 3.5, Bellevue - WA
Oracle, Software Developer, 3.8, Seattle - WA
Electronic Arts, Software Engineer - C# and WPF - Frostbite - Audio and Movie, 3.9, Seattle - WA
Bytedance, Network Software Development Engineer, 3.8, Seattle - WA
HCL Americas, Developer, 2.7, King County - WA
Uber, Software Engineer -- Machine Learning Platform (Seattle), 3.8, Seattle - WA 98101 (Downtown area)
Pariveda Solutions, Software Engineer, 4.4, Seattle - WA 98101 (Denny Triangle area)
Microsoft, Applied Scientist / Software Engineer, 4.2, Bellevue - WA 98004 (Downtown area)
Facebook, Software Engineer - Real-Time Data Specialist, 4.2, Seattle - WA 98101 (Downtown area)
Duolingo, Software Engineer - Web, 5.0, Seattle - WA
Amazon.com Services LLC, Software Development Engineer - CloudTune, 3.6, Seattle - WA
Google, Software Engineer - Infrastructure, 4.3, Seattle - WA
Dell, SG Storage Software Engineer Intern, 4.0, Seattle - WA 98133 (Broadview area)
Oracle, Software Engineer (JoinOCI-NLSDST), 3.8, Seattle - WA
TableSafe Inc., Full Stack Software Developer, 3.5, Kirkland - WA
Blue Origin, Software System Safety Engineer, 3.3, Kent - WA 98032
Microsoft, Software Developement Engineer II, 4.2, Redmond - WA
Microsoft, Software Engineer II - Xbox Live Identity Services, 4.2, Redmond - WA
Facebook, FRL Researcher Tools Software Engineer, 4.2, Redmond - WA
LUMEDX Corporation, Software Development Engineer, NaN, Bellevue - WA 98004 (Downtown area)
Splunk, Software Developer Engineer in Test Intern (Summer 2020), 4.1, Seattle - WA
Facebook, Software Engineer - Core Systems (Oculus), 4.2, Seattle - WA 98101 (Downtown area)
Glowforge, Senior Full Stack Software Engineer, 4.0, Seattle - WA 98134 (Industrial District area)
Hewlett Packard Enterprise, AI Engineer Intern, 3.7, Seattle - WA
Nintendo of America Inc., Intern - Graphics Software Engineer (NTD), 4.1, Redmond - WA
Zulily, Software Engineer 2 - iOS, 3.2, Seattle - WA 98121 (Belltown area)
SpaceX, Software Engineer (Starlink), 3.7, Redmond - WA 98052 (SE Redmond area)
Amazon.com Services LLC, Software Development Engineer I (Level 4), 3.6, Seattle - WA
FLEXE - Inc., Software Engineer, NaN, Seattle - WA
Google, Software Engineer - Engineering Productivity, 4.3, Seattle - WA
Facebook, FRL Researcher Tools Software Engineer, 4.2, Redmond - WA
Facebook, Systems Software Engineer - Oculus Browser, 4.2, Seattle - WA 98101
Axon, Staff Software Engineer - Axon Records, 3.2, Seattle - WA 98103
Amazon.com Services LLC, AWS S3 Software Development Engineer, 3.6, Seattle - WA
Infostretch Corporation, DevOps Engineer, 3.1, Seattle - WA
Amazon.com Services LLC, Software Development Engineer - Amazon Subscription Boxes, 3.6, Seattle - WA
HCL Americas, Technical Lead, 2.7, King County - WA
Expedia.com, Software Development Engineer II - Machine Learning, 3.9, Bellevue - WA 98004
RareCyte Inc, Front End Developer, NaN, Seattle - WA 98121
Expedia Group, Internship - Multiple Locations - Software Development, 3.9, Seattle - WA 98119
Expedia.com, Principal - Software Development Engineer, 3.9, Seattle - WA 98119
Agilysys - Inc., Software Development Internships (Summer 2020), NaN, Bellevue - WA 98007 (Eastgate area)
4C Insights, Software Development Engineer In Test (SDET), NaN, Seattle - WA
Facebook, Recruiting Manager - Software Engineering, 4.2, Seattle - WA 98101
Tesla, Software Engineer, 3.5, Bellevue - WA
Friendly Consultants, Software Engineer, NaN, Bothell - WA
Amazon.com Services LLC, Software Development Engineer - Prime Video Discovery, 3.6, Seattle - WA
Clean Power Research, Software Engineer, NaN, Kirkland - WA 98004 (Downtown area)
Facebook, Software Engineer - News Feed, 4.2, Seattle - WA 98101 (Downtown area)
Inabia Solutions and Consulting, Software Development Engineer, NaN, Bellevue - WA 98004 (Downtown area)
Urban Influence, Jr. FrontEnd Developer, NaN, Seattle - WA 98122 (Central District area)
Facebook, User Interaction Platform Software Engineer, 4.2, Redmond - WA
PillPack - LLC, Software Development Engineer, 3.6, Seattle - WA
GE Healthcare, Software Engineer, 4.0, Seattle - WA 98104
Facebook, Software Engineer - Mobile Performance, 4.2, Seattle - WA 98101 (Downtown area)
Amazon.com Services - Inc., Amazon - Software Development Engineer, 3.6, Seattle - WA
Amazon.com Services LLC, Software Development Engineer (Full Stack), 3.6, Seattle - WA
EMD, Software Development Engineer, 4.0, Seattle - WA
Amazon.com Services LLC, Software Developer -- Aurora, 3.6, Seattle - WA
Facebook, Software Engineer - Search Ranking, 4.2, Seattle - WA 98101 (Downtown area)
Tyler Technologies - Inc., Software Development Engineer in Test, 3.6, Seattle - WA
Apple, Siri- Software Development Engineer in Test, 4.2, Seattle - WA
Hewlett Packard Enterprise, ML Engineer Intern, 3.7, Seattle - WA
Zillow, Software Development Engineer - Growth Engineering, 3.8, Seattle - WA 98101 (Downtown area)
Hydroid, Software Engineer - Lynnwood - WA, 3.8, Lynnwood - WA 98036
HCL Americas, SR. TECHNICAL LEAD, 2.7, King County - WA
IMDb.com - Inc., Software Developer Engineer, 3.6, Seattle - WA
Zulily, Software Engineer 2 - iOS, 3.2, Seattle - WA 98121 (Belltown area)
SpaceX, Software Engineer (Starlink), 3.7, Redmond - WA 98052 (SE Redmond area)
Centrify, Principle DevOps Software Engineer, 4.0, Bellevue - WA
Ace-stack LLC, Java script developer (HTML), NaN, Redmond - WA
University of Washington, BIOINFORMATICS ANALYST/SOFTWARE ENGINEER, 4.1, Seattle - WA
Lowe's Inc., IT Software Engineer, 3.6, Kirkland - WA
