Amazon.com Services - Inc., Software Development Engineer (Networking Applications), 3.6, Seattle - WA
VMware, Member of Technical Staff Bellevue - WA, 4.1, Bellevue - WA 98004 (Downtown area)
Amazon.com Services - Inc., Software Development Engineer - AA, 3.6, Seattle - WA
lululemon athletica, Software Engineer (Oracle Retail – RMS/ReSA), 4.3, Seattle - WA
Amazon.com Services - Inc., Software Engineer - Directed Work, 3.6, Seattle - WA
Avalara, Sr. Full-Stack Engineer (6163), 2.8, Seattle - WA 98104 (Pioneer Square area)
Amazon Capital Services - Inc., Front-End Engineer, 3.6, Seattle - WA
Amazon.com Services LLC, Software Dev Engineer II-TEST, 3.6, Seattle - WA
Expedia.com, Software Development Engineer II - AWS, 3.9, Bellevue - WA 98004 (Downtown area)
FLEXE - Inc., Software Development Manager, NaN, Seattle - WA 98104 (Pioneer Square area)
Gigamon, Staff Software Engineer - Infrastructure Engineer, 3.4, Seattle - WA
Apple, Siri - Senior Software Engineer - Information Domains, 4.2, Seattle - WA
GE Digital, Staff Software Test Engineer, 3.3, Redmond - WA 98052
Oracle, Software Developer 2 (JoinOCI), 3.8, Seattle - WA
Microsoft, Senior Software Engineer - Front End, 4.2, Redmond - WA
Groupon - Inc., Software Development Engineer, 3.6, Seattle - WA 98101 (Downtown area)
SARJ, Engineer, NaN, Seattle - WA 98101 (Downtown area)
Amazon.com Services - Inc., Software Developer Engineer, 3.6, Seattle - WA
University of Washington, FULL STACK DEVELOPER, 4.1, Seattle - WA
Vizio Inc., Sr. Software Engineer - Android, NaN, Seattle - WA 98109 (Westlake area)
Amazon.com Services LLC, Software Development Engineer – Amazon DynamoDB, 3.6, Seattle - WA
Oracle, Full Stack Developer - IC2 - OCI, 3.8, Seattle - WA
Amazon.com Services LLC, Software Development Engineer - Fire TV Search, 3.6, Seattle - WA
ASSURANCE, Senior Software Engineer - Core Team, 3.9, Bellevue - WA
Hitachi Vantara, OBIEE Application Developer, 3.4, Seattle - WA
Wheels Up Partners LLC, Front-End Developer, NaN, Seattle - WA 98109 (Westlake area)
Infoblox, Software Test Engineer, 3.6, Tacoma - WA 98402 (Newtacoma area)
Microsoft, Senior Security Software Engineer, 4.2, Redmond - WA
Dude Solutions - Inc., Software QA Engineer, 3.0, Poulsbo - WA
Amazon.com Services LLC, Frontend Engineer - Customer Service Applications, 3.6, Seattle - WA
Motorola Solutions, DevOps Engineer, 4.1, Seattle - WA 98121 (Belltown area)
Hulu, Senior Software Developer - Android, 3.9, Seattle - WA
Apple, Siri - Senior Software Engineer - Movies & TV, 4.2, Seattle - WA
Dude Solutions - Inc., Software Engineer, 3.0, Poulsbo - WA
Microsoft, Senior Software Developer Engineer, 4.2, Bellevue - WA 98004 (Downtown area)
University of Washington, PYTHON DEVELOPER, 4.1, Seattle - WA
Amazon Corporate LLC, Software Engineer, 3.6, Seattle - WA
Premera Blue Cross, DevOps Engineer II, 3.6, Mountlake Terrace - WA 98043
Amazon.com Services - Inc., Software Development Engineer - Amazon Publishing, 3.6, Seattle - WA
GoDaddy, Principal Software Development Engineer, 3.6, Kirkland - WA
Fluke, Software Design Engineer, 3.6, Everett - WA 98203
Quantcast, Software Engineer - Audience Platform, 3.4, Seattle - WA
FidelityLife, Web Developer I, NaN, Bellevue - WA
Envestnet Asset Management - Inc, Software Dev Eng Test III, NaN, Seattle - WA
Amazon.com Services LLC, Software Engineer - Analytics, 3.6, Seattle - WA
Amazon.com Services - Inc., Software Development Engineer - Ordering Platform, 3.6, Seattle - WA
GE Digital, Staff Electrical Power Systems Software Engineer, 3.3, Redmond - WA 98052
Oracle, Software Developer - Architect, 3.8, Seattle - WA
Accenture, Entry Level Accenture Technology Advanced Application Engine..., 4.0, Seattle - WA 98101 (Downtown area)
Discovery Communications, Software Engineering Director, 4.2, Bellevue - WA
University of Washington, RESEARCH SCIENTIST ENGINEER 1, 4.1, Seattle - WA
Google, Staff Software Engineer, 4.3, Seattle - WA
Oracle, Software Developer - OCI (Serverless), 3.8, Seattle - WA
HBO Max, Staff Software Engineer - Core Media Engine, NaN, Seattle - WA
Friendly Consultants, Software Development Engineer in Test, NaN, Tumwater - WA
Grid Dynamics, Java Developer, NaN, Kirkland - WA
Electronic Arts, Sr. Game Designer, 3.9, Seattle - WA
ServiceNow, Staff Software Engineer, 3.6, Kirkland - WA 98033 (Highlands area)
Amazon.com Services - Inc., Software Development Engineer - Amazon Chime, 3.6, Seattle - WA
Amazon.com Services LLC, Software Development Engineer – Prime Air, 3.6, Seattle - WA
Wish, Senior Software Engineer, 3.9, Seattle - WA 98103 (Green Lake - Wallingford area)
Amazon.com Services - Inc., Software Development Engineer - Robotics Applications - Amazo..., 3.6, Seattle - WA
Costco Travel, Software Development Engineer - Data Warehouse - America's #..., 4.2, Issaquah - WA 98027
Amazon.com Services - Inc., Software Development Engineer - Alexa Personality, 3.6, Seattle - WA
Aloden, Software Engineer/ C# .net developer, NaN, Bellevue - WA
Amazon.com Services - Inc., Software Development Engineer - AWS S3, 3.6, Seattle - WA
Redfin, Software Development Manager (Production Engineering), 3.3, Seattle - WA 98121 (Belltown area)
Oracle, Network Engineer - OCI Network Reliability Engineering, 3.8, Seattle - WA
The Walt Disney Company (Corporate), Manager of Software Engineering, 4.1, Seattle - WA
Amazon.com Services - Inc., Software Development Engineer - Chile Event January 13-17, 3.6, Seattle - WA
Groupon - Inc., Senior Software Engineer, 3.6, Seattle - WA 98101 (Downtown area)
Moogsoft, Senior Software Development Engineer in Test, NaN, Seattle - WA
Amazon.com Services LLC, Front-End Engineer, 3.6, Seattle - WA
Envestnet Asset Management - Inc, Software Developer Intern, NaN, Seattle - WA
Take-Two Interactive Software - Inc., Producer, 4.1, Seattle - WA
ASSURANCE, Machine Learning Engineer, 3.9, Bellevue - WA
surfwavetech, Software Design Engineer III, NaN, Bellevue - WA
Arup, Intune Engineer - Automation, 4.1, Seattle - WA 98104
Zonar Systems, Software Development Engineer II, 3.0, Seattle - WA 98188
Axon, Senior Software Engineer - Axon Records & Integrations, 3.2, Seattle - WA 98103 (Green Lake - Wallingford area)
University of Washington, SOFTWARE DEVELOPER, 4.1, Seattle - WA
Nordstrom, Engineer 2 - RFDS - Price Team - Full Stack, 3.9, Seattle - WA
Pythonwise, DEVOPS ENGINEER, NaN, Seattle - WA
Amazon.com Services LLC, Embedded Software Engineer - Amazon Scout, 3.6, Seattle - WA
Amazon.com Services - Inc., Software Development Engineer - Games, 3.6, Seattle - WA
Amazon.com Services LLC, Sr Software Development Engineer - Ordering Platform, 3.6, Seattle - WA
State of Washington Office of Financial Management, Software Development Engineer in Test (SDET), 3.4, Olympia - WA
Amazon.com Services - Inc., Software Development Engineer-AB, 3.6, Seattle - WA
Costco Travel, Software Development Engineer in Test (OME) - Real Work/Life..., 4.2, Issaquah - WA 98027
First Mode, Firmware Engineer, NaN, Seattle - WA
SoFi, Senior Engineer - Software, 3.1, Seattle - WA
QVC, Software Engineer 2 - Machine Learning, 3.8, Seattle - WA
Costco Travel, Software Development Engineer in Test - SOA, 4.2, Issaquah - WA 98027
Starbucks, undergraduate or graduate intern - App Developer/Data Scienti..., 4.0, Seattle - WA
Amazon.com Services - Inc., Software Development Engineer - Paid Search, 3.6, Seattle - WA
Microsoft, Machine Learning Engineer, 4.2, Bellevue - WA 98004 (Hidden Valley area)
Oracle, Software Developer 4 - OCI, 3.8, Seattle - WA
Microsoft, Principal Software Engineer/Architect, 4.2, Redmond - WA
Zulily, Lead Software Engineer - Site Full Stack, 3.2, Seattle - WA 98121 (Belltown area)
JPMorgan Chase, Software Engineer- Site Reliability Engineering - Cloud Techn..., 3.9, Seattle - WA 98101 (Downtown area)
Starbucks, senior platform software engineer - Engineering - Information..., 4.0, Seattle - WA
Amazon.com Services LLC, Software Development Engineer - Amazon Workspaces Bellevue -..., 3.6, Bellevue - WA
Echodyne, Embedded Software Test Engineer, 4.0, Kirkland - WA
HYPERPROOF, Back-End Software Development Engineer, NaN, Bellevue - WA
Amazon.com Services LLC, Software Development Engineer -- Elastic Block Storage, 3.6, Seattle - WA
Electronic Arts, Sr. Game Designer, 3.9, Seattle - WA
Amazon.com Services - Inc., Software Dev Engineer - Prime Air, 3.6, Seattle - WA
Amazon.com Services LLC, Software Development Engineer - AWS AI, 3.6, Seattle - WA
Amazon.com Services LLC, Web Development Engineer, 3.6, Seattle - WA
Zillow Group, Senior Software Development Engineer - Growth Engineering, 3.8, Seattle - WA 98101 (Downtown area)
Zulily, Software Engineer II – Fulfillment Center Systems, 3.2, Seattle - WA 98121 (Belltown area)
Nordstrom, Software Engineer 2 - Supply Chain Tech - Warehouse Platform, 3.9, Seattle - WA
Inabia Solutions and Consulting, Full Stack Web Developer, NaN, Redmond - WA 98052
Amazon.com Services - Inc., Software Development Engineer - Content Understanding, 3.6, Seattle - WA
Amazon.com Services - Inc., Prime Air Software Development Engineer, 3.6, Seattle - WA
Amazon.com Services - Inc., Software Dev Engineer - Amazon Assistant, 3.6, Seattle - WA
Zulily, Senior Software Engineer, 3.2, Seattle - WA 98121 (Belltown area)
HBO Max, Staff Software Engineer - Video Delivery, NaN, Seattle - WA
Amazon.com Services - Inc., Software Development Engineer - Content Understanding, 3.6, Seattle - WA
Amazon.com Services - Inc., Software Development Engineer - AWS Lambda, 3.6, Seattle - WA
Amazon.com Services - Inc., Software Development Engineer – AWS Internet of Things (IoT), 3.6, Seattle - WA
Amazon.com Services LLC, Sr. Software Development Engineer, 3.6, Seattle - WA
Expedia.com, Manager - Software Development, 3.9, Bellevue - WA 98004 (Downtown area)
Jet City Consulting, Software Developer, NaN, Bainbridge Island - WA
Microsoft, Software Engineering Manager, 4.2, Bellevue - WA 98004 (Downtown area)
University of Washington, SOFTWARE DEVELOPER, 4.1, Seattle - WA
Amazon.com Services - Inc., Software Development Engineer - SCOT, 3.6, Seattle - WA
National General Insurance, LeadCloud Software Developer II, 3.1, Seattle - WA
Blue Nile, Sr. Software Engineer, 3.1, Seattle - WA 98109 (South Lake Union area)
DocuSign, Senior Software Engineer, 3.7, Seattle - WA 98101
Amazon.com Services LLC, Software Development Engineer - Analytics, 3.6, Seattle - WA
Amazon.com Services - Inc., Software Development Engineer – Amazon DynamoDB, 3.6, Seattle - WA
ZT Group ZT Systems, Field Services Engineer- Software & Validation, NaN, Seattle - WA 98104
Daimler, Senior Software Engineer, 4.1, Seattle - WA 98101 (Downtown area)
Amazon.com Services - Inc., Software Development Engineer- Alexa Deep Product Knowledge, 3.6, Seattle - WA
Amazon Web Services - Inc., Software Development Engineer (Fullstack), 3.6, Seattle - WA
Getty Images, Senior Software Engineer, 3.9, Seattle - WA 98103 (Fremont area)
Amazon.com Services - Inc., Software Development Engineer - AA, 3.6, Seattle - WA
SpaceX, Constellation Operations and Automation Engineer, 3.7, Redmond - WA 98052
Apptentive, Mobile Software Engineer, NaN, Seattle - WA
Ekata - Inc., Software Engineer - Data Services, 5.0, Seattle - WA
Microsoft, Senior Software Developer Engineer, 4.2, Bellevue - WA 98004
Socrata, Software Test Engineer, 4.0, Seattle - WA
Waymo, Software Engineer - Perception - Computer Vision / ML - Seatt..., 3.0, Seattle - WA
Beyondsoft Consulting, Software Developer --- Web & Mobile Technologies, 3.4, Kent - WA
Grab Taxi, Lead Software Engineer - Backend (Segmentation), 3.9, Bellevue - WA
Globant, Sr. Java Software Engineer, 4.2, Seattle - WA 98104
Wipro Limited, Application Modernization - Mainframe-Lead, 3.8, Bellevue - WA 98004 (Downtown area)
Pivotal Commware, Hardware Test Engineer, NaN, Kirkland - WA
Amazon.com Services LLC, Front-End Engineer - Selling Partner Services, 3.6, Seattle - WA
Microsoft, Internship Opportunities for Students: Firmware Engineer, 4.2, Redmond - WA
Hardsuit Labs Inc, AI Engineer, NaN, Seattle - WA 98106 (North Delridge area)
Seattle Shopping Guide, Web Designers/Programmers Developers, NaN, Seattle - WA
HBO Max, Staff Software Engineer II - Platform Infrastructure, NaN, Seattle - WA
Twitter, Senior Software Engineer - Logging & Tracing, 4.1, Seattle - WA
Costco Travel, Software Development Engineer in Test - Products and Markets..., 4.2, Issaquah - WA 98027
GE Digital, DevOps Engineer, 3.3, Redmond - WA 98052
Zillow Group, Senior Software Engineer - Zillow Offers, 3.8, Seattle - WA 98101 (Downtown area)
Qualtrics, Senior Software Engineer - Employee Experience, 4.3, Seattle - WA
Akraya Inc., Software Dev Engineer IV : 19-05190, 3.6, Bellevue - WA 98004 (Downtown area)
Content Solutions, Web Developer/Designer, NaN, Seattle - WA
DocuSign, Lead Software Engineer – Data Clarity, 3.7, Seattle - WA 98101 (Downtown area)
Splunk, Sr Software Engineer - Developer Platform, 4.1, Seattle - WA
NVIDIA, Computer Vision Engineer - Mapping - Autonomous Vehicles, 4.2, Redmond - WA
Facebook, Manager - Software Engineering - AI Infra (Menlo Park), 4.2, Seattle - WA 98101 (Downtown area)
Amazon.com Services LLC, Software Development Engineer - Large Scale & High Impact, 3.6, Seattle - WA
Oracle, OCI Data Engineer, 3.8, Seattle - WA
Performance, Systems or Software Engineer - Flight Contols, NaN, Bothell - WA 98021
Google, iOS Software Engineer, 4.3, Seattle - WA
Puget Sound Energy, Principle Identity Engineer, 3.8, Redmond - WA 98052
Qualtrics, Technology Consultant - Customer Experience, 4.3, Seattle - WA
Microsoft, Software Architect, 4.2, Redmond - WA
Microsoft, Sr. Software Development Engineer – Quantum Development Kit, 4.2, Redmond - WA
Hulu, Product Design Intern - Summer 2020, 3.9, Seattle - WA
Third Republic, Deployment Engineer, NaN, Seattle - WA 98101 (Downtown area)
Amazon.com Services - Inc., Software Development Engineer - Treasure Truck, 3.6, Seattle - WA
Oracle, Member of Technical Staff - OCI, 3.8, Seattle - WA
Oracle, Member of Technical Staff- Oracle Public Cloud - JoinOCI-Blo..., 3.8, Seattle - WA
Toysmith, IT Developer, 2.7, Sumner - WA 98390
Brooks Sports - Inc, QA Software Test Engineer, 4.0, Seattle - WA
Amazon.com Services - Inc., Software Development Engineer - Digital Royalty Platform, 3.6, Seattle - WA
Expedia.com, Software Development Engineer II - Fullstack, 3.9, Seattle - WA 98119 (Queen Anne area)
Amazon.com Services LLC, Sr. Software Development Engineer, 3.6, Seattle - WA
REI, Release Manager, 4.1, Bellevue - WA 98004 (Wilburton area)
Amazon.com Services - Inc., Software Dev Engineer - Amazon Assistant, 3.6, Seattle - WA
Amazon.com Services - Inc., Software Development Engineer - ATROPS Config Management, 3.6, Seattle - WA
BI Worldwide, Technical Sales Support, 3.8, Seattle - WA 98122 (Central District area)
Amazon Web Services - Inc., Frontend Software Development Engineer AWS, 3.6, Seattle - WA
Contegix, Atlassian Engineer, 3.3, Seattle - WA
Outreach, Senior Software Engineer - Devtooling, NaN, Seattle - WA 98103 (Green Lake - Wallingford area)
Amazon.com Services - Inc., Software Development Engineer - Unified Authorization, 3.6, Seattle - WA
Amazon Web Services - Inc., Front End Engineer I - AWS Activate, 3.6, Seattle - WA
Highbrow Technologies, Python Developer, NaN, Bellevue - WA
Amazon.com Services - Inc., Software Development Engineer - Amazon Alexa, 3.6, Seattle - WA
First Mode, Firmware Engineer, NaN, Seattle - WA
Amazon.com Services - Inc., SDE - Amazon Chime, 3.6, Seattle - WA
Honeywell, Product Manufacturing Engineer I (Automation), 3.8, Redmond - WA 98052
Hitachi Vantara, OBIEE Application Developer, 3.4, Seattle - WA
Convoy, Software Engineer - Mobile, 3.9, Seattle - WA 98121 (Belltown area)
Amazon.com Services LLC, Software Development Engineer - AWS SSO, 3.6, Seattle - WA
Avani Technology Solutions Inc, Developer, 4.6, Bellevue - WA
Microsoft, Software Engineer Lead, 4.2, Bellevue - WA 98004 (Downtown area)
Amazon.com Services - Inc., SDM, 3.6, Seattle - WA
lululemon athletica, Software Engineer (Oracle Retail – RMS/ReSA), 4.3, Seattle - WA
Zulily, Software Engineer II – Fulfillment Center Systems, 3.2, Seattle - WA 98121 (Belltown area)
Veritas Services & Engineering Inc, Engineer, NaN, Kirkland - WA 98034
Facebook, Machine Learning Engineer (Conversational AI Group), 4.2, Seattle - WA 98101
Amazon.com Services - Inc., Software Development Engineer - FreeRTOS Embedded, 3.6, Seattle - WA
Samsung Electronics, Engineer III - Software Process Engineering, 4.0, Bellevue - WA 98004 (Downtown area)
Zonar Systems, Fullstack Software Developer II, 3.0, Seattle - WA 98188
Port of Seattle, Software Test Engineer, 3.8, Seattle - WA
Nordstrom, Site Reliability Engineer - NOC, 3.9, Seattle - WA
Amazon.com Services LLC, Software Development Engineer - LMT Special Programs, 3.6, Bellevue - WA
Logic20/20, Java Developer, 3.5, Seattle - WA 98115 (Ravenna area)
Oracle, Software Development Engineer - Member of Technical Staff, 3.8, Seattle - WA
Facebook, Manager - Software Engineering - Machine Learning, 4.2, Seattle - WA 98101 (Downtown area)
Intrepid Pursuits, Mobile iOS Apprentice, NaN, Seattle - WA
Carta, Senior Software Engineer - Investor Services (Multiple Levels..., 3.8, Seattle - WA 98104 (Downtown area)
Amazon.com Services LLC, Software Development Engineer - Alexa AI, 3.6, Seattle - WA
Wipro Limited, Azure IOT-Lead, 3.8, Redmond - WA
Carta, Senior Software Engineer - Financial Analytics, 3.8, Seattle - WA 98104 (Downtown area)
Schweitzer Engineering Laboratories, Lead Software Engineer, 3.9, Lynnwood - WA
Amazon Registry Services - Inc., Software Development Engineer - Amazon Registry Services, 3.6, Seattle - WA
Moogsoft, Senior Full Stack Engineer, NaN, Seattle - WA
West Corporation, Sr Software Engineer (Messaging), 3.3, Seattle - WA
Oracle, Site Reliability / DevOps Engineer, 3.8, Seattle - WA
UST Global, Assoc. Software Architect, 3.7, Bellevue - WA
Zulily, Software Engineering Manager - Android, 3.2, Seattle - WA 98121 (Belltown area)
Expedia.com, Principal Software Dev Engineer, 3.9, Bellevue - WA 98004 (Downtown area)
BOEING, Experienced Full Stack Developer - Creative Services, 4.0, Seattle - WA
Qualtrics, Software Development Manager - EX, 4.3, Seattle - WA
Amazon.com Services LLC, SOFTWARE DEV ENGINEER, 3.6, Seattle - WA
Oath Inc, Senior Software Developer, 3.8, Seattle - WA
Microsoft, Principal Software Engineer Manager, 4.2, Redmond - WA
Accenture, Java Development Engineer, 4.0, Seattle - WA 98101 (Downtown area)
Facebook, Game Engine Systems Engineer - Spatial Computing Runtime Team..., 4.2, Seattle - WA 98101 (Downtown area)
Daimler, Principal Software Engineer, 4.1, Seattle - WA 98101 (Downtown area)
Beyondsoft Consulting, Backend Service Engineer, 3.4, Redmond - WA
EPAM Systems, Python Developer, 3.9, Seattle - WA
Motorola Solutions, Senior Security Software Engineer, 4.1, Seattle - WA 98121 (Belltown area)
Valorem, Software Engineer II, 3.8, Seattle - WA 98101 (Downtown area)
Facebook, Software Engineering Manager, 4.2, Redmond - WA
Amazon.com Services LLC, Software Development Engineer - Alexa Connected Devices, 3.6, Seattle - WA
Zillow Group, Machine Learning Engineer - Computer Vision, 3.8, Seattle - WA 98101 (Downtown area)
Amazon.com Services LLC, Software Development Engineer: Classification and Policy Pla..., 3.6, Seattle - WA
Amazon.com Services - Inc., ES Tech - Software Development Engineer - Learning Products, 3.6, Seattle - WA
Ekata - Inc., Software Engineer - Data Services, 5.0, Seattle - WA
CrowdStrike, Sensor Engineer Intern (Summer 2020), 2.9, Kirkland - WA 98033 (Highlands area)
Amazon.com Services LLC, Software Development Engineer - Java - Distributed Systems, 3.6, Seattle - WA
VMware, Sr. Member of Technical Staff Bellevue - WA, 4.1, Bellevue - WA 98004 (Downtown area)
Amazon.com Services - Inc., Software Engineer - Machine Learning Systems, 3.6, Seattle - WA
Tune, Software Support Engineer, 3.7, Seattle - WA
Amazon.com Services LLC, Software Development Manager for Sports Fan Experience, 3.6, Seattle - WA
BTI Solutions, Software Engineer 4 (WA), 2.6, Bellevue - WA
Kaiser Permanente, Java Developer II, 4.2, Renton - WA 98056
Amazon.com Services - Inc., Software Development Engineer – Embedded, 3.6, Seattle - WA
Amazon.com Services LLC, Frontend Engineer, 3.6, Seattle - WA
Denali Advanced Integration, Software Engineer - Embedded Linux, 2.5, Redmond - WA 98052
Amazon.com Services - Inc., Software Development Engineer - Amazon Kinesis Data Streams, 3.6, Seattle - WA
Logic20/20, Machine Learning Engineer(s), 3.5, Seattle - WA 98115 (Wedgwood area)
Square, Senior Software Engineer - Payments, 3.7, Seattle - WA
Magic Leap - Multiple Locations, Software Engineer - Unreal Engine 4, 3.3, Seattle - WA
Palantir Technologies, DevOps Engineer, 4.2, Seattle - WA
Amazon Web Services - Inc., Frontend Software Development Engineer AWS, 3.6, Seattle - WA
Amazon.com Services - Inc., Software Development Engineer Test - Alexa Automotive, 3.6, Seattle - WA
Redfin, Software Development Manager (Dev Tools), 3.3, Seattle - WA
Amazon.com Services LLC, Software Dev Engineer, 3.6, Seattle - WA
Amazon.com Services - Inc., Software Development Engineer - Alexa Music, 3.6, Seattle - WA
TableSafe Inc., Linux Cloud Engineer, 3.5, Kirkland - WA
Veritas Services & Engineering Inc, Engineer, NaN, Kirkland - WA 98034
Kaiser Permanente, Applications Systems Programming Analyst II, 4.2, Renton - WA 98056
Costco Travel, Software Development Engineer in Test (OME) - Real Work/Life..., 4.2, Issaquah - WA 98027
Zillow, Machine Learning Engineer - Intern, 3.8, Seattle - WA 98101 (Downtown area)
Costco Travel, Software Development Engineer in Test - Products and Markets..., 4.2, Issaquah - WA 98027
Amazon.com Services - Inc., Software Development Engineer - Alexa Personality, 3.6, Seattle - WA
Facebook, Developer Communications Manager - AR/VR, 4.2, Seattle - WA 98101 (Downtown area)
Amazon Web Services - Inc., Software Development Engineer - Amazon EC2, 3.6, Seattle - WA
Amazon.com Services LLC, AWS Outposts Software Development Engineer, 3.6, Seattle - WA
Beyondsoft Consulting, Software Design Engineer in Test, 3.4, Redmond - WA
Intrepid Pursuits, Mobile iOS Apprentice, NaN, Seattle - WA
Amazon.com Services LLC, Front-End Engineer - Amazon Connect (AWS), 3.6, Seattle - WA
Microsoft, Software Development Lead, 4.2, Redmond - WA
The Climate Corporation, Sr. Staff Software Engineer - Backend (Multiple levels), 3.6, Seattle - WA 98104
2K Games, Senior Gameplay Engineer, 3.7, Kirkland - WA
Amazon.com Services LLC, Software Development Engineer - Datapath Fleet Efficiency, 3.6, Seattle - WA
Bungie, Producer, 4.0, Bellevue - WA 98004 (Downtown area)
Stormhaven, Backend Engineer, NaN, Seattle - WA
Facebook, Operations Program Manager - Infrastructure Data Centers (Uni..., 4.2, Fremont - WA
Grab Taxi, Senior Software Engineer - Backend (Streaming Data), 3.9, Seattle - WA
Palantir Technologies, DevOps Engineer, 4.2, Seattle - WA
Amazon.com Services LLC, Software Development Manager, 3.6, Seattle - WA
Oracle, Sr. Network Development Engineer, 3.8, Seattle - WA
Redfin, Software Development Manager (Dev Tools), 3.3, Seattle - WA
GE Digital, Sr Software Engineer - Electric SCADA Full stack, 3.3, Redmond - WA 98052
Adobe, Senior Backend Software Engineer - Bizible, 4.3, Seattle - WA
Pivotal Commware, Hardware Test Engineer, NaN, Kirkland - WA
ServiceNow, Senior Software Engineer - Monitoring, 3.6, Kirkland - WA 98033 (Highlands area)
Costco Wholesale, Software Developer - BigID #3380~, 4.2, Issaquah - WA 98027
Amazon.com Services - Inc., Software Development Engineer - Enterprise Engineering, 3.6, Bellevue - WA
Outreach, Principal Software Engineer - Voice Intelligence, NaN, Seattle - WA 98103 (Green Lake - Wallingford area)
Outreach, Machine Learning Engineer, NaN, Seattle - WA
KPMG, Associate - AI Engineer, 4.0, Seattle - WA 98101 (Downtown area)
DocuSign, Lead Software Engineer – Storage and infrastructure, 3.7, Seattle - WA 98101 (Downtown area)
Amazon.com Services - Inc., Software Development Engineer - AWS CloudFormation (Seattle), 3.6, Seattle - WA
West Corporation, Sr Software Engineer (Messaging), 3.3, Seattle - WA
Amazon.com Services - Inc., Web Development Engineer - Alexa Skill Certification, 3.6, Bellevue - WA
DDS WIRELESS INTL INC., Software Developer - IQUX / Dev Inc, NaN, Redmond - WA 98052
Oath Inc, Senior Software Developer, 3.8, Seattle - WA
Amazon.com Services - Inc., Software Development Engineer - Last Mile Technology - Special..., 3.6, Bellevue - WA
Amazon.com Services - Inc., Software Development Engineer - Traffic Shaping/Caching Team, 3.6, Seattle - WA
Amazon.com Services LLC, Software Development Engineer - Alexa Games, 3.6, Seattle - WA
Amazon.com Services - Inc., SDE (ReactJS and Front-End), 3.6, Seattle - WA
Palantir Technologies, DevOps Engineer, 4.2, Seattle - WA
Zulily, Manager Software Engineering, 3.2, Seattle - WA 98121 (Belltown area)
University of Washington, SOFTWARE DEVELOPMENT MANAGER II, 4.1, Seattle - WA
Square, Senior Software Security Engineer - Infrastructure, 3.7, Seattle - WA
Outreach, Software Engineering Manager - Analytics, NaN, Seattle - WA
Zulily, Senior Software Engineer – Engagement, 3.2, Seattle - WA 98121 (Belltown area)
Pensar Development, Embedded Systems Software Engineer, NaN, Seattle - WA 98103
DocuSign, Lead Software Engineer – Security, 3.7, Seattle - WA 98101 (Downtown area)
Alibaba, 阿里云智能事业群 Staff software Engineer 云监控领域, 4.0, Seattle - WA
Amazon.com Services LLC, Software Development Engineer - Alexa Experience, 3.6, Seattle - WA
New Relic, Lead Software Engineer - Web, 3.0, Seattle - WA 98121 (Belltown area)
Amazon.com Services LLC, Software Development Manager - Sustainability, 3.6, Seattle - WA
Amazon.com Services - Inc., Software Development Engineer - Distributed Services, 3.6, Seattle - WA
